{
  "event_id": "0197a3b0-6c1e-7d3a-8f4b-2f9c1d2e3f62",
  "occurred_at": "2026-07-11T09:00:20Z",
  "tenant": "acme",
  "event_type": "step.skipped",
  "actor": {
    "principal": "svc:orchestrator",
    "delegation_chain": [{ "sub": "user:jane.doe" }, { "sub": "svc:orchestrator" }]
  },
  "action": { "name": "step.skipped" },
  "reason": {
    "task_id": "0197a3b0-6c1e-7d3a-8f4b-2f9c1d2e3f40",
    "step_id": "0197a3b0-6c1e-7d3a-8f4b-2f9c1d2e3f52",
    "plan_step": "2/2: correlate CI/deploy activity for the implicated repo"
  },
  "artifacts": { "workflow_run_id": "task-0197a3b0-run-1" },
  "details": {
    "capability": "code.ci_health",
    "gap": "code.ci_health: skipped — depends on cloud.cost_analysis, which failed"
  }
}
