{
  "event_id": "0197a3b0-6c1e-7d3a-8f4b-2f9c1d2e3f50",
  "occurred_at": "2026-07-10T09:00:12Z",
  "tenant": "acme",
  "event_type": "policy.decision",
  "actor": {
    "principal": "agent:knowledge-agent@0.1.0",
    "delegation_chain": [
      { "sub": "user:jane.doe", "role": "tenant-user" },
      { "sub": "svc:orchestrator", "role": "platform" },
      {
        "sub": "agent:knowledge-agent@0.1.0",
        "role": "agent",
        "scopes": ["knowledge:search:read"]
      }
    ]
  },
  "action": {
    "name": "tool:knowledge-store:search:read",
    "inputs_digest": "sha256:9f86d081884c7d659a2feaa0c55ad015a3bf4f1b2b0b822cd15d6c15b0f00a08"
  },
  "reason": {
    "task_id": "0197a3b0-6c1e-7d3a-8f4b-2f9c1d2e3f40",
    "step_id": "0197a3b0-6c1e-7d3a-8f4b-2f9c1d2e3f44",
    "policy": {
      "decision": "allow",
      "bundle_version": "2026.07.01",
      "determining_policies": ["allow-r0-knowledge-read"]
    }
  },
  "artifacts": {
    "agent_id": "knowledge-agent",
    "agent_version": "0.1.0",
    "workflow_run_id": "task-0197a3b0-run-1",
    "trace_id": "4bf92f3577b34da6a3ce929d0e0e4736"
  }
}
