{
  "event_id": "0197a3b0-6c1e-7d3a-8f4b-2f9c1d2e3f70",
  "occurred_at": "2026-07-11T15:12:44Z",
  "tenant": "acme",
  "event_type": "model.invoked",
  "actor": {
    "principal": "agent:cloud-agent@0.1.0",
    "delegation_chain": [
      { "sub": "user:jane.doe", "role": "tenant-user" },
      { "sub": "svc:orchestrator", "role": "platform" },
      { "sub": "agent:cloud-agent@0.1.0", "role": "agent" }
    ]
  },
  "action": {
    "name": "llm:default-tier",
    "inputs_digest": "sha256:9f86d081884c7d659a2feaa0c55ad015a3bf4f1b2b0b822cd15d6c15b0f00a08",
    "outputs_digest": "sha256:2c26b46b68ffc68ff99b453c1d30413413422d706483bfa0f98a5e886266e7ae"
  },
  "reason": {
    "task_id": "0197a3b0-6c1e-7d3a-8f4b-2f9c1d2e3f40",
    "step_id": "0197a3b0-6c1e-7d3a-8f4b-2f9c1d2e3f44"
  },
  "artifacts": {
    "agent_id": "cloud-agent",
    "model": "dev/dev-echo@1"
  },
  "details": {
    "model_class": "default-tier",
    "provider": "dev",
    "outcome": "ok",
    "attempts": [
      { "provider": "dev", "model": "dev-echo@1", "outcome": "ok", "duration_ms": 3 }
    ],
    "usage": {
      "input_tokens": 42,
      "output_tokens": 17,
      "cache_read_input_tokens": 320,
      "cache_creation_input_tokens": 0
    },
    "prefix_digest": "sha256:5e884898da28047151d0e56f8dc6292773603d0d6aabbdd62a11ef721d1542d8",
    "model_classes_version": "2026.07",
    "purpose": "agent"
  }
}
