{
  "event_id": "0197a3b0-6c1e-7d3a-8f4b-2f9c1d2e3f61",
  "occurred_at": "2026-07-11T09:00:01Z",
  "tenant": "acme",
  "event_type": "task.planned",
  "actor": {
    "principal": "svc:orchestrator",
    "delegation_chain": [{ "sub": "user:jane.doe" }, { "sub": "svc:orchestrator" }]
  },
  "action": {
    "name": "task.planned",
    "outputs_digest": "sha256:9f86d081884c7d659a2feaa0c55ad015a3bf4f1b2b0b822cd15d6c15b0f00a08"
  },
  "reason": { "task_id": "0197a3b0-6c1e-7d3a-8f4b-2f9c1d2e3f40" },
  "artifacts": { "workflow_run_id": "task-0197a3b0-run-1" },
  "details": {
    "planner": "rule-planner@1",
    "plan": {
      "plan_id": "0197a3b0-6c1e-7d3a-8f4b-2f9c1d2e3f50",
      "task_id": "0197a3b0-6c1e-7d3a-8f4b-2f9c1d2e3f40",
      "tenant": "acme",
      "planner": "rule-planner@1",
      "steps": [
        {
          "step_id": "0197a3b0-6c1e-7d3a-8f4b-2f9c1d2e3f51",
          "capability": "cloud.cost_analysis",
          "input": {}
        }
      ],
      "created_at": "2026-07-11T09:00:00Z"
    }
  }
}
