{
  "event_id": "0197a3b0-6c1e-7d3a-8f4b-2f9c1d2e3f60",
  "occurred_at": "2026-07-11T08:31:00Z",
  "tenant": "platform",
  "event_type": "agent.baseline_recorded",
  "actor": {
    "principal": "svc:agent-ci",
    "delegation_chain": [{ "sub": "svc:agent-ci", "role": "platform" }]
  },
  "action": { "name": "agent.baseline_recorded" },
  "artifacts": {
    "agent_id": "knowledge-agent",
    "agent_version": "0.1.0"
  },
  "details": {
    "agent_version": "0.1.0",
    "suite_digest": "sha256:9f86d081884c7d659a2feaa0c55ad015a3bf4f1b2b0b822cd15d6c15b0f00a08",
    "metrics": {
      "pass_rate": 1.0,
      "citation_precision": 0.9583,
      "abstention_accuracy": 1.0
    }
  }
}
