{
  "event_id": "0197a3b0-6c1e-7d3a-8f4b-2f9c1d2e3f53",
  "occurred_at": "2026-07-10T09:00:13Z",
  "tenant": "acme",
  "event_type": "retrieval.served",
  "actor": {
    "principal": "agent:knowledge-agent@0.1.0",
    "delegation_chain": [
      { "sub": "user:jane.doe", "role": "tenant-user" },
      { "sub": "svc:orchestrator", "role": "platform" },
      { "sub": "agent:knowledge-agent@0.1.0", "role": "agent" }
    ]
  },
  "action": {
    "name": "knowledge.search",
    "inputs_digest": "sha256:9f86d081884c7d659a2feaa0c55ad015a3bf4f1b2b0b822cd15d6c15b0f00a08",
    "outputs_digest": "sha256:60303ae22b998861bce3b28f33eec1be758a213c86c93c076dbe9f558c11c752"
  },
  "reason": {
    "task_id": "0197a3b0-6c1e-7d3a-8f4b-2f9c1d2e3f40",
    "step_id": "0197a3b0-6c1e-7d3a-8f4b-2f9c1d2e3f44"
  },
  "artifacts": {
    "agent_id": "knowledge-agent",
    "agent_version": "0.1.0",
    "lineage_ids": ["0197a3b0-6c1e-7d3a-8f4b-2f9c1d2e3f42", "0197a3b0-6c1e-7d3a-8f4b-2f9c1d2e3f45"],
    "trace_id": "4bf92f3577b34da6a3ce929d0e0e4736"
  }
}
